{
  "schemaVersion": 1,
  "catalogId": "regional-northern-europe",
  "sourceVersion": "2026.10.3",
  "terms": [
    "Northern Europe",
    "Scandinavia",
    "Nordic countries",
    "Baltic states",
    "Norway",
    "Sweden",
    "Denmark",
    "Finland",
    "Iceland"
  ],
  "articles": [
    "51st (Highland) Division War Memorial",
    "Aalborg Air Base",
    "Aalborg Historical Museum",
    "Aalholm",
    "Aalto Centre, Seinäjoki | Aalto Centre",
    "Aarhus Cathedral",
    "ABBA The Museum | The ABBA Museum",
    "Abbot Hall Art Gallery",
    "Aberdeen Art Gallery",
    "Aberdeen Maritime Museum",
    "Aberdeenshire",
    "Aberdeenshire Canal | Aberdeen Canal",
    "Aberdour Castle",
    "Abergeldie Castle",
    "Aberlour distillery | Aberlour (distillery)",
    "Abernethy Round Tower",
    "Abernethy, Perth and Kinross | Abernethy",
    "Achamore House",
    "Achiltibuie | Aichilidh Bhuidhe | Aichillidh Bhuidhe",
    "Achnacarry | Achadh na Cairidh",
    "Aclare",
    "Adam Mickiewicz Monument, Vilnius | Adam Mickiewicz Monument",
    "Adolfström",
    "Affric-Beauly hydro-electric power scheme | Beauly Cascade | Glen Affric Hydro Electric Scheme",
    "Aggersborg",
    "Agivey River",
    "Ahoghill",
    "Aikey Brae stone circle | Aiky Brae | Parkhouse Hill stone circle",
    "Ailsa Craig",
    "Air Base Karup",
    "Airlie Castle",
    "Akaa | Ackas",
    "Akershus Fortress",
    "Alauna (Maryport) | Alauna | Alione",
    "Alexander Church | Aleksanterin kirkko",
    "Alexander Nevsky Cathedral, Tallinn | Alexander Nevsky Cathedral",
    "Alexander Palace",
    "Alford Valley Railway | Alford Railway Museum",
    "Alhambra Theatre Glasgow",
    "Alhambra Theatre, Morecambe | Alhambra Theatre | Alhambra Palace Theatre | Astoria Super Cinema | Carleton Club",
    "Alladale Wilderness Reserve",
    "Allenheads",
    "Alloway",
    "Alness | Alanais",
    "Alnmouth Lifeboat Station | Lifeboat Station, Alnmouth",
    "Alnwick",
    "Alnwick Castle",
    "Alnwick Garden",
    "Alpha Ventus Offshore Wind Farm | Borkum West",
    "Alston Moor | Alston with Garrigill",
    "Alta Hydroelectric Power Station | Alta",
    "Altaelva",
    "Altenhus Fortress",
    "Altinaghree Castle | Altnacree Castle | Liscloon House | Ogilbys Castle",
    "Altnahinch Dam",
    "Alvar Aalto Museum",
    "Amalienborg",
    "Amble",
    "Amble Lifeboat Station",
    "Ambleside",
    "Amharclann Ghaoth Dobhair",
    "Amhuinnsuidhe Castle | Fincastle",
    "Amrum",
    "Amrum Lighthouse | Leuchtturm Amrum | Lighthouse Amrum | Seefeuer Amrum",
    "Amrumbank West",
    "Amuri, Tampere | Amuri",
    "An Grianán Theatre | An Grianan Theatre",
    "An Teallach",
    "Andenes Lighthouse | Andenes fyr",
    "Andreas, Isle of Man | Andreas",
    "Andrew Carnegie Birthplace Museum",
    "Angeln",
    "Anichkov Palace",
    "Annaglogh Lead Mines",
    "Antoniev Monastery",
    "Antrim Hills | Antrim Plateau",
    "Appleby Horse Fair",
    "Appleby-in-Westmorland | Appleby",
    "Applecross",
    "Aquhorthies stone circle",
    "Arbroath Abbey | Abbey of Aberbrothock",
    "Arbroath | Aberbrothock",
    "Archipelago National Park | Archipelago Sea National Park | Saaristomeren kansallispuisto | Skärgårdshavets nationalpark",
    "Archipelago Sea | Saaristomeri | Skärgårdshavet",
    "Arctic and Antarctic Museum",
    "Arctic–Alpine Botanic Garden",
    "Ardbeg distillery | An Àird Bheag | Taigh-staile na h-Àirde Bige",
    "Ardchattan Priory",
    "Ardgay | Àird Ghaoithe",
    "Ardglass",
    "Ardgowan Castle",
    "Ardlui | Àird Laoigh",
    "Ardnamurchan",
    "Ardnamurchan Lighthouse",
    "Ardoch Roman Fort | Alauna | Ardoch, Roman military complex 900m NNE of Ardoch Bridge",
    "Ardrossan Castle",
    "Ardrossan Lifeboat Station",
    "Ardrossan | Àird Rosain",
    "Ards Forest Park",
    "Ardtornish",
    "Ardtornish Castle",
    "Ardvreck Castle",
    "Ardwell",
    "Argyll's Lodging | Argyle Lodging | Argyll Lodging",
    "Arisaig | Arasaig",
    "Arktikum",
    "Armagh",
    "Armoy",
    "Arnis, Germany | Arnis",
    "Arran Lifeboat Station",
    "Arranmore",
    "Arranmore Lifeboat Station",
    "Arrochar Alps",
    "Art Museum Riga Bourse | Museum Riga Bourse",
    "Arthur's Seat | Arthur Seat | Arthurs Seat | Suidhe Artair",
    "Artigarvan",
    "Artscape Nordland | Skulpturlandskap Nordland",
    "Ashbrooke",
    "Ashington",
    "Ashton Memorial",
    "Aspatria",
    "Assistens Cemetery (Copenhagen) | Assistens Cemetery | Assistens Kirkegård",
    "Assynt",
    "Astrup Fearnley Museum of Modern Art",
    "Attymass",
    "Auchindoun Castle | Auchindown Castle",
    "Auchinleck House",
    "Auchinleck | Achadh nan Leac",
    "Auckland Castle | Auckland Palace | Bishop's Castle | Bishop's Palace",
    "Audley's Castle",
    "Audleystown Court Tomb",
    "Aughleam | Aghleam | Eachleim",
    "Aurlandsfjord | Aurlandsfjorden",
    "Aviemore | An Aghaidh Mhòr",
    "Awe Hydro-Electric Scheme",
    "Aydon Castle",
    "Ayr Cathedral",
    "Ayr Lifeboat Station",
    "Ayrshire | Siorrachd Àir",
    "Bailiffgate Museum",
    "Balblair distillery",
    "Baleshare",
    "Balfour Castle",
    "Balgonie Castle",
    "Balhousie Castle | Black Watch Castle & Museum | Black Watch Regimental Museum",
    "Balivanich",
    "Ballabeg",
    "Ballabeg, Lonan | Ballabeg",
    "Ballachulish",
    "Balladoole",
    "Ballantrae Lifeboat Station",
    "Ballasalla",
    "Ballaugh",
    "Ballaugh (parish) | Ballaugh",
    "Ballina, County Mayo | Ballina",
    "Balloch Castle",
    "Ballycarry",
    "Ballycastle, County Antrim | Ballycastle | Baile an Chaistil | Ballykessel | Bellycaissle",
    "Ballycastle, County Mayo | Ballycastle",
    "Ballyconnell",
    "Ballycroy, County Mayo | Ballycroy",
    "Ballygilgan",
    "Ballyglass Lifeboat Station",
    "Ballygroll Prehistoric Landscape",
    "Ballyhornan",
    "Ballyliffin",
    "Ballymena | The Mena",
    "Ballymoney",
    "Ballymote",
    "Ballymote Castle",
    "Ballysadare | Ballisodare | Ballysodare",
    "Ballyshannon",
    "Ballywalter",
    "Ballywalter Lifeboat Station",
    "Balmerino Abbey",
    "Balmoral Castle | Balmoral",
    "Baltic Centre for Contemporary Art",
    "Baltic Ice Lake",
    "Balvaird Castle",
    "Balvenie Castle",
    "Bamburgh",
    "Bamburgh Castle Lifeboat Station",
    "Bamburgh Castle | Bamborough Castle",
    "Banff and Macduff Lifeboat Station",
    "Banff Town House | Banff, 34 Low Street, Town House",
    "Bangor Abbey",
    "Bangor Erris",
    "Bangor, County Down | Bangor",
    "Bannockburn | Allt a' Bhonnaich",
    "BARD Offshore 1",
    "Barnard Castle",
    "Barnbougle Castle",
    "Baronscourt",
    "Barpa Langass",
    "Barra",
    "Barra Head Lighthouse",
    "Barra Head | Bearnaraigh | Berneray | Beàrnaraigh",
    "Barra Island Lifeboat Station",
    "Barrow Lifeboat Station",
    "Barrow-in-Furness | Barrow",
    "Barvas | Barabhas | Barbhas",
    "Bass Rock",
    "Bass Rock Lighthouse",
    "Bawnboy",
    "Bay of Skaill",
    "Bayble Island",
    "Beadnell",
    "Bealach na Bà | Bealach na Ba",
    "Beamish Museum | Beamish | North of England Open Air Museum",
    "Beauly",
    "Beauly Priory",
    "Beinn Eighe",
    "Beith",
    "Belcoo",
    "Belfast Castle",
    "Belfast City Council | Bilfawst Citie Cooncil | Comhairle Cathrach Bhéal Feirste",
    "Bell Rock Lighthouse",
    "Bellacorick",
    "Belleek, County Fermanagh | Belleek",
    "Belmullet",
    "Belnahua",
    "Bempton Cliffs",
    "Ben Alder",
    "Ben Lomond | Beinn Laomainn",
    "Ben Nevis Distillery",
    "Ben Nevis | Beinn Nibheis",
    "Benbecula Distillery",
    "Benbecula | Beinn na Faoghla",
    "Benbulbin",
    "Beningbrough Hall",
    "Benmore Botanic Garden | Benmore (Younger Botanic Garden) | Younger Botanic Garden",
    "Berg concentration camp | Berg fengsel | Berg prison",
    "Bergen Cathedral",
    "Bergen | Bjørgvin",
    "Bernera Barracks",
    "Berwick Castle",
    "Berwick-upon-Tweed Lifeboat Station | Berwick Upon Tweed Lifeboat Station",
    "Berwick-upon-Tweed | Berwick",
    "Bettyhill | Am Blàran Odhar",
    "Billown Circuit",
    "Binghamstown",
    "Biržai Castle",
    "Bishop Auckland | Bishop-Auckland",
    "Bishop's Palace, Kirkwall | Bishop's Palace",
    "Bishopscourt, Isle of Man | Bishopscourt",
    "Bishopwearmouth | Bishop Wearmouth | Bp. Wearmouth",
    "Björklinge runestones | U 1046",
    "Black Combe",
    "Black Isle",
    "Blacklion",
    "Blackness Castle",
    "Blackrock Island, County Mayo | Blackrock Island",
    "Blacksod Bay",
    "Blacksod Lighthouse | Fód Dubh",
    "Blair Castle",
    "Blairgowrie and Rattray",
    "Bleikvasslia",
    "Blood Road Museum",
    "Blyth Lifeboat Station",
    "Blåmannsisen | Ålmåjalosjiegņa",
    "Bo'ness | Borrowstounness",
    "Boden Fortress | Bodens fästning",
    "Bodø Cathedral | Bodø domkirke",
    "Boho Caves",
    "Boho, County Fermanagh | Boho",
    "Bohus Fortress | Bohus fästning",
    "Boleskine House",
    "Bolton Castle",
    "Bonar Bridge | Bonarbridge",
    "Bonawe Iron Furnace | Bonawe, Iron Furnace | Lorn Furnace",
    "Boreraig",
    "Borgholm Castle | Borgholms slott",
    "Borgring | Borrering",
    "Borgund Stave Church | Borgund stavkyrkje",
    "Borre mound cemetery",
    "Borremose",
    "Borrowdale",
    "Borthwick Castle",
    "Borve Castle, Benbecula | Borve Castle",
    "Bostadh (Iron Age settlement) | Bostadh",
    "Botanical Garden of Uppsala University",
    "Bothal Castle",
    "Bothwell",
    "Bothwell Castle",
    "Boulmer Lifeboat Station",
    "Bowes Castle",
    "Bowes Museum | Barnard Castle",
    "Bowness-on-Windermere | Bowness on Windermere",
    "Boyne Castle",
    "Braak Bog Figures",
    "Bradda Head",
    "Braddan",
    "Braemar",
    "Braemar Castle",
    "Brahan Castle",
    "Brantwood",
    "Breadalbane Hydro-Electric Scheme",
    "Breagh gas field",
    "Brechin",
    "Brechin Cathedral",
    "Bremstein Lighthouse | Bremstein fyr",
    "Bridlington",